{
  "$schema": "https://json-schema.org/draft/2020-12/schema",
  "$id": "https://kata.dev/schemas/user-choice-gate.schema.json",
  "title": "Kata user choice gate",
  "type": "object",
  "required": [
    "taskId",
    "boundary",
    "createdAt"
  ],
  "additionalProperties": false,
  "properties": {
      "reusedFromTaskChoice": {
        "type": "boolean",
        "description": "Set when this boundary reused the task-level choice instead of asking again. The reuse path materialises the record at the boundary, so this field is the audit trail for it — and it was missing from this schema while the writer wrote it, which made the record unreadable to its own reader."
      },
    "taskId": {
      "type": "string",
      "minLength": 1
    },
    "boundary": {
      "type": "string",
      "enum": [
        "implementation_gate",
        "review_gate",
        "judge_gate",
        "archive_gate"
      ]
    },
    "revisionId": {
      "type": "string",
      "minLength": 1
    },
    "manifestHash": {
      "type": "string"
    },
    "codeManifestHash": {
      "description": "Content identity of the revision's code paths only (C2). Stamped beside manifestHash so a code-scoped verdict can outlive a governance-text edit; absent when the split cannot be derived, in which case a code-scoped binding refuses to match.",
      "type": "string"
    },
    "governanceManifestHash": {
      "description": "The governance-text surface at the time of this verdict (§22/§24). A text-only edit expires what this surface was verified for, and nothing else.",
      "type": "string"
    },
    "instrumentManifestHash": {
      "description": "The declared-instrument surface at the time of this verdict (§24.4). Editing a declared instrument expires the instrument surface only — not the pass about the deliverable.",
      "type": "string"
    },
    "candidateFreezeSha256": {
      "description": "The frozen candidate this verdict answered (§7.4). Stamped beside the manifest so the conclusion binds to the reviewed content and semantic contract rather than to the declared owned paths, which cannot see a change committed outside the declaration.",
      "type": "string"
    },
    "createdAt": {
      "type": "string",
      "minLength": 1
    },
    "choice": {
      "type": "string",
      "enum": [
        "continue_current",
        "switched",
        "delegated"
      ]
    },
    "approvedAt": {
      "type": "string",
      "minLength": 1
    },
    "consumedAt": {
      "type": "string",
      "minLength": 1
    }
  }
}
