{
  "taskId": "route-the-wiki-store-through-its-owner",
  "boundary": "review_gate",
  "manifestHash": "6c72e91cf7a520f75ca092abe8365ccfdfa2fcd3a870a491734fefae7b660f98",
  "createdAt": "2026-10-06T11:44:26.944Z",
  "choice": "continue_current",
  "approvedAt": "2026-10-06T11:48:26.436Z",
  "consumedAt": "2026-10-06T11:48:26.891Z"
}
